{
  "reportVersion": "ores.otel.log/conformance-report/v1",
  "contract": "ores.otel.log/backpressure-result/v1",
  "schemaVersion": 1,
  "vectorSet": "ores.otel.log/backpressure-vectors/v1",
  "vectorDigest": "sha256:2222222222222222222222222222222222222222222222222222222222222222",
  "implementation": {
    "language": "nodejs",
    "version": "0.1.0",
    "sourceSha": "1111111111111111111111111111111111111111"
  },
  "runtime": {
    "name": "node",
    "version": "24.0.0"
  },
  "results": {
    "total": 10,
    "passed": 10,
    "failed": 0,
    "failures": []
  }
}
